06462000,NIOBRARA RIVER NR NORDEN NEBR,Non-ref,WestPlains,22387.92,10L,42.786947,-100.0354,NE,,,31.0,31.0,0.0,POINT (-328142.411072015 2205866.249493869)
06463500,"LONG PINE CREEK NEAR RIVERVIEW, NEBR.",Non-ref,WestPlains,1235.096,10L,42.689508,-99.678956,NE,,yes,60.0,59.0,20.0,POINT (-299594.4279889205 2193808.783153216)
06465500,"NIOBRARA RIVER NR. VERDEL, NEBR.",Non-ref,WestPlains,33197.99,10L,42.739683,-98.224319,NE,,yes,52.0,51.0,20.0,POINT (-181034.1307511986 2195735.242951565)
06470500,"JAMES RIVER AT LAMOURE, ND",Non-ref,CntlPlains,11189.83,10U,46.355525,-98.304543,ND,,yes,59.0,59.0,20.0,POINT (-177798.0766265506 2598457.094933357)
06470878,JAMES RIVER AT ND-SD STATE LINE,Non-ref,CntlPlains,13773.15,10U,45.936358,-98.174269,SD,,yes,27.0,27.0,19.0,POINT (-168812.9855065233 2551727.042218795)
06471000,JAMES R AT COLUMBIA SD,Non-ref,CntlPlains,14790.2,10U,45.60358,-98.310376,SD,,yes,32.0,31.0,12.0,POINT (-180276.8903236341 2515028.030509228)
06473000,JAMES R AT ASHTON SD,Non-ref,CntlPlains,26455.08,10U,44.998308,-98.480927,SD,,yes,57.0,54.0,19.0,POINT (-195338.8121847422 2448082.274008726)
06480000,BIG SIOUX RIVER NEAR BROOKINGS SD,Non-ref,CntlPlains,8138.36,10L,44.17997,-96.74894,SD,,yes,56.0,56.0,20.0,POINT (-59693.13244795299 2354620.871321237)
06481000,BIG SIOUX R NEAR DELL RAPIDS SD,Non-ref,CntlPlains,9662.446,10L,43.790251,-96.745329,SD,,yes,61.0,60.0,20.0,POINT (-59746.14256206879 2311158.798385554)
06482020,BIG SIOUX R AT NORTH CLIFF AVE AT SIOUX FALLS SD,Non-ref,CntlPlains,11568.33,10L,43.566919,-96.711161,SD,,yes,38.0,38.0,20.0,POINT (-57193.7266272924 2286218.303683398)
06600500,"Floyd River at James, IA",Non-ref,CntlPlains,2297.873,10L,42.57666,-96.311416,IA,,yes,74.0,60.0,20.0,POINT (-25407.64263935354 2175437.460399501)
06606600,"Little Sioux River at Correctionville, IA",Non-ref,CntlPlains,6454.256,10L,42.470517,-95.797649,IA,,yes,82.0,60.0,20.0,POINT (16534.63894828859 2163547.907679952)
06606700,"Little Sioux River near Kennebec, IA",Non-ref,CntlPlains,7077.277,10L,42.0811,-96.014179,IA,,,30.0,20.0,0.0,POINT (-1165.079889000284 2119984.074633076)
06710000,"SOUTH PLATTE RIVER AT LITTLETON, CO.",Non-ref,WestMnts,7968.601,10L,39.618877,-105.01915,CO,,,45.0,37.0,0.0,POINT (-766126.0343260753 1880652.420847935)
06711565,"SOUTH PLATTE RIVER AT ENGLEWOOD, CO.",Non-ref,WestMnts,8781.412,10L,39.664987,-105.004149,CO,,yes,26.0,26.0,20.0,POINT (-764366.7588109473 1885675.749829876)
06713500,"CHERRY CREEK AT DENVER, CO.",Non-ref,WestPlains,1063.21,10L,39.742487,-104.999982,CO,,yes,53.0,46.0,20.0,POINT (-763192.8093241228 1894287.985334208)
06714800,"LEAVENWORTH CREEK AT MOUTH NEAR GEORGETOWN, CO",Non-ref,WestMnts,72.5292,10L,39.68721,-105.70028,CO,,yes,6.0,6.0,6.0,POINT (-823009.9386647495 1893967.930594637)
06752260,"CACHE LA POUDRE RIVER AT FORT COLLINS, CO.",Non-ref,WestMnts,2920.828,10L,40.589149,-105.0697,CO,,yes,34.0,34.0,20.0,POINT (-760047.8820824381 1989275.031112967)
06754000,"SOUTH PLATTE RIVER NEAR KERSEY, CO.",Non-ref,WestMnts,25015.64,10L,40.412203,-104.563292,CO,,,102.0,58.0,18.0,POINT (-719512.418639686 1965597.511406729)
06775500,"MIDDLE LOUP RIVER AT DUNNING, NEBR.",Ref,WestPlains,5459.764,10L,41.831244,-100.100778,NE,yes,yes,64.0,60.0,20.0,POINT (-338065.3160038164 2099328.193321519)
06787500,"CALAMUS RIVER NEAR BURWELL, NEBR.",Non-ref,WestPlains,2568.365,10L,41.810289,-99.183044,NE,,,55.0,46.0,6.0,POINT (-262518.8989045413 2094085.331967907)
06790500,NORTH LOUP RIVER NR ST PAUL NEBR,Non-ref,WestPlains,11142.12,10L,41.263346,-98.449236,NE,,yes,81.0,60.0,20.0,POINT (-203591.5100562713 2031099.156557924)
06792000,"CEDAR RIVER NEAR FULLERTON, NEBR.",Non-ref,WestPlains,3150.11,10L,41.394578,-98.003986,NE,,,55.0,46.0,6.0,POINT (-166276.6782297966 2044919.001131057)
06800500,"ELKHORN RIVER AT WATERLOO, NE",Non-ref,CntlPlains,17988.7,10L,41.293331,-96.283772,NE,,yes,80.0,59.0,20.0,POINT (-23580.97630670301 2031867.37495035)
06803500,"SALT CREEK AT LINCOLN, NEBR.",Non-ref,CntlPlains,1774.213,10L,40.846758,-96.681719,NE,,yes,60.0,60.0,20.0,POINT (-57007.97522333224 1982035.28552592)
06803530,"ROCK CREEK NEAR CERESCO, NEBR.",Ref,CntlPlains,309.7458,10L,41.015697,-96.544283,NE,yes,yes,39.0,39.0,20.0,POINT (-45406.83879298573 2000878.622463978)
06809000,"Davids Creek near Hamlin, IA",Non-ref,CntlPlains,67.9518,10L,41.673598,-94.805816,IA,,,21.0,21.0,0.0,POINT (98697.36591712426 2075013.577094369)
06809500,"East Nishnabotna River at Red Oak, IA",Non-ref,CntlPlains,2317.012,10L,41.008604,-95.241658,IA,,yes,79.0,60.0,20.0,POINT (63270.68279072372 2000206.822918024)
06810000,"Nishnabotna River above Hamburg, IA",Non-ref,CntlPlains,7281.761,10L,40.632501,-95.625826,IA,,yes,82.0,60.0,20.0,POINT (31384.52214485346 1957896.573658895)
06817000,"Nodaway River at Clarinda, IA",Non-ref,CntlPlains,1971.839,10L,40.739407,-95.013229,IA,,yes,76.0,60.0,20.0,POINT (82641.60814506588 1970237.372119308)
06821500,"ARIKAREE RIVER AT HAIGLER, NEBR.",Non-ref,WestPlains,5622.584,10L,40.029286,-101.967586,NE,,yes,77.0,60.0,20.0,POINT (-504455.1054904961 1906102.722643085)
06828500,"REPUBLICAN RIVER AT STRATTON, NEBR.",Non-ref,WestPlains,21006.47,10L,40.140981,-101.230264,NE,,yes,59.0,59.0,20.0,POINT (-441506.3850122918 1914925.878637072)
06829500,"REPUBLICAN RIVER AT TRENTON, NEBR.",Non-ref,WestPlains,21445.72,10L,40.166553,-101.047828,NE,,,46.0,44.0,4.0,POINT (-425968.8998106434 1916954.097643463)
06837000,REPUBLICAN RIVER AT MCCOOK NEBR,Non-ref,WestPlains,31752.04,10L,40.187647,-100.618575,NE,,yes,55.0,55.0,20.0,POINT (-389660.7655922555 1917472.343232595)
06841000,"MEDICINE CREEK ABOVE HARRY STRUNK LAKE, NE",Non-ref,WestPlains,2014.673,10L,40.500519,-100.322856,NE,,,44.0,44.0,5.0,POINT (-363135.4680466703 1951312.065308144)
06845200,"SAPPA CREEK NEAR BEAVER CITY, NEBR.",Non-ref,WestPlains,3916.573,10L,40.04584,-99.890401,NE,,,36.0,24.0,1.0,POINT (-328913.7876702708 1898847.080441082)
06847000,"BEAVER CREEK NEAR BEAVER CITY, NEBR.",Ref,WestPlains,5223.181,10L,40.120007,-99.893457,NE,,,57.0,45.0,5.0,POINT (-328831.6680442776 1907160.498174317)
06847500,"SAPPA CREEK NEAR STAMFORD, NEBR.",Non-ref,WestPlains,9855.951,10L,40.131794,-99.554633,NE,,yes,63.0,60.0,20.0,POINT (-300180.0853343565 1907358.837836678)
06881000,"BIG BLUE RIVER NEAR CRETE, NEBR.",Non-ref,WestPlains,7024.251,10L,40.596556,-96.960436,NE,,yes,56.0,56.0,20.0,POINT (-80597.84215348047 1954215.928674328)
06887000,"BIG BLUE R NR MANHATTAN, KS",Non-ref,WestPlains,24991.78,10L,39.237135,-96.571431,KS,,yes,59.0,59.0,20.0,POINT (-48869.71541094013 1801635.131781605)
06892360,"KILL C AT 95TH ST NR DESOTO, KS",Non-ref,CntlPlains,124.1127,10L,38.956667,-94.973611,KS,,yes,6.0,6.0,6.0,POINT (88116.84483340367 1770529.084702779)
06892495,"CEDAR C NR DESOTO, KS",Non-ref,CntlPlains,151.1271,10L,38.978056,-94.922778,KS,,yes,7.0,7.0,7.0,POINT (92453.56840970127 1772974.571639677)
06892513,"MILL C AT JOHNSON DRIVE, SHAWNEE, KS",Non-ref,CntlPlains,150.5421,10L,39.029167,-94.817222,KS,,yes,7.0,7.0,7.0,POINT (101441.2658025825 1778810.484836285)
06893100,"BLUE R AT KENNETH RD, OVERLAND PARK, KS",Non-ref,CntlPlains,170.8281,10L,38.842222,-94.612222,KS,,yes,6.0,6.0,6.0,POINT (119327.9608309519 1758097.087673733)
06893390,"INDIAN C AT STATE LINE RD, LEAWOOD, KS",Non-ref,CntlPlains,167.4594,10L,38.938333,-94.607778,KS,,yes,6.0,6.0,6.0,POINT (119552.2404943058 1768874.028633029)
06893500,"Blue River at Kansas City, MO",Non-ref,CntlPlains,477.0423,10L,38.957003,-94.5589,MO,,yes,70.0,60.0,20.0,POINT (123717.4222679064 1771028.924491818)
06893562,"Brush Creek at Rockhill Road in Kansas City, MO",Non-ref,CntlPlains,46.8063,10L,39.03925,-94.578722,MO,,yes,11.0,11.0,11.0,POINT (121877.9828519168 1780220.72581956)
06893970,"Spring Branch Creek at Holke Rd in Independence, M",Non-ref,CntlPlains,21.8032,10L,39.08834,-94.34356,MO,,yes,4.0,4.0,4.0,POINT (141945.8920213319 1786048.489090435)
06894000,"Little Blue River near Lake City, MO",Non-ref,CntlPlains,480.4056,10L,39.100561,-94.300504,MO,,yes,61.0,60.0,20.0,POINT (145610.6356435918 1787483.141705428)
06898000,"Thompson River at Davis City, IA",Non-ref,CntlPlains,1801.335,10L,40.64028,-93.80828,IA,,yes,74.0,60.0,20.0,POINT (183798.5999162818 1960825.542697972)
06903400,"Chariton River near Chariton, IA",Ref,CntlPlains,481.4154,10L,40.95189,-93.259848,IA,yes,yes,44.0,44.0,20.0,POINT (228772.7750451564 1996902.16762941)
06903900,"Chariton River near Rathbun, IA",Non-ref,CntlPlains,1407.987,10L,40.821872,-92.891254,IA,,yes,51.0,51.0,18.0,POINT (260012.170638113 1983297.020378052)
07030392,"WOLF RIVER AT LAGRANGE, TN",Ref,SEPlains,542.9284,08,35.03259,-89.246736,TN,,yes,13.0,13.0,13.0,POINT (610513.0809386749 1352148.526306454)
07056515,"Bear Creek near Silver Hill, AR",Ref,EastHghlnds,209.871,11,35.94,-92.713333,AR,,yes,10.0,10.0,10.0,POINT (293802.3144502922 1437099.728842156)
07060500,"White River at Calico Rock, AR",Non-ref,EastHghlnds,25801.86,11,36.116181,-92.143209,AR,,yes,70.0,60.0,20.0,POINT (343940.5353754536 1458728.534265025)
07061270,"East Fork Black River near Lesterville, MO",Ref,EastHghlnds,135.3564,11,37.552556,-90.842444,MO,,yes,6.0,6.0,6.0,POINT (451111.0688400441 1624920.407620273)
07061300,"EAST FORK BLACK RIVER AT LESTERVILLE, MO",Non-ref,EastHghlnds,242.9307,11,37.450111,-90.827111,MO,,yes,33.0,33.0,4.0,POINT (453075.4845904904 1613529.302722643)
07061600,"Black River below Annapolis, MO",Non-ref,EastHghlnds,1281.728,11,37.325049,-90.764009,MO,,yes,3.0,3.0,3.0,POINT (459368.6170937289 1599838.040747434)
07076000,Little Red River near Heber Springs,Non-ref,EastHghlnds,2976.488,11,35.517301,-91.997371,AR,,,53.0,31.0,0.0,POINT (359761.9582649097 1392271.012985954)
07079300,"EF ARKANSAS R AT US HIWAY 24, NR LEADVILLE, CO.",Non-ref,WestMnts,129.2832,11,39.272489,-106.306413,CO,,yes,19.0,19.0,19.0,POINT (-879271.479615887 1853176.099950028)
07081200,"ARKANSAS RIVER NEAR LEADVILLE, CO.",Non-ref,WestMnts,254.2401,11,39.257211,-106.343636,CO,,yes,35.0,35.0,19.0,POINT (-882620.5836600041 1851818.993551571)
07086000,"ARKANSAS RIVER AT GRANITE, CO.",Non-ref,WestMnts,1116.546,11,39.042771,-106.265855,CO,,,97.0,58.0,18.0,POINT (-878600.7136212458 1827205.118115968)
07087200,"ARKANSAS RIVER AT BUENA VISTA, CO.",Non-ref,WestMnts,1669.15,11,38.849162,-106.12474,CO,,,23.0,23.0,4.0,POINT (-868876.9738178123 1804332.144084223)
07091200,"ARKANSAS RIVER NEAR NATHROP, CO.",Non-ref,WestMnts,2731.15,11,38.652219,-106.051126,CO,,yes,22.0,22.0,4.0,POINT (-864913.656779256 1781710.373785316)
07094500,"ARKANSAS RIVER AT PARKDALE, CO.",Non-ref,WestMnts,6373.378,11,38.487219,-105.373604,CO,,yes,40.0,36.0,5.0,POINT (-808629.2190517273 1757346.834689018)
07096000,"ARKANSAS RIVER AT CANON CITY, CO.",Non-ref,WestMnts,7940.421,11,38.433887,-105.257213,CO,,yes,110.0,60.0,20.0,POINT (-799201.8995567661 1750413.109535947)
07097000,"ARKANSAS RIVER AT PORTLAND, CO.",Non-ref,WestMnts,10246.7,11,38.388334,-105.016096,CO,,yes,47.0,37.0,19.0,POINT (-778932.6160985128 1743328.839989599)
07099970,"ARKANSAS RIVER AT MOFFAT STREET AT PUEBLO, CO",Non-ref,WestMnts,12259.25,11,38.253614,-104.606085,CO,,yes,21.0,21.0,20.0,POINT (-744975.0923658621 1725006.00192331)
07105530,"FOUNTAIN CR BLW JANITELL RD BLW COLO. SPRINGS, CO",Non-ref,WestMnts,1071.976,11,38.803049,-104.795807,CO,,yes,19.0,19.0,19.0,POINT (-755659.9347983607 1787830.166824137)
07105800,"FOUNTAIN CREEK AT SECURITY, CO.",Non-ref,WestMnts,1316.769,11,38.72944,-104.733861,CO,,yes,45.0,45.0,20.0,POINT (-751110.3013527119 1779123.693882586)
07106000,"FOUNTAIN CREEK NEAR FOUNTAIN, CO.",Non-ref,WestPlains,1768.522,11,38.601665,-104.67025,CO,,yes,40.0,29.0,20.0,POINT (-746959.858833462 1764360.425613468)
07106300,"FOUNTAIN CREEK NEAR PINON, CO.",Non-ref,WestPlains,2194.774,11,38.439722,-104.593583,CO,,yes,36.0,36.0,20.0,POINT (-742012.0897121007 1745683.053433631)
07106500,"FOUNTAIN CREEK AT PUEBLO, CO.",Non-ref,WestPlains,2404.412,11,38.28778,-104.601085,CO,,yes,66.0,54.0,20.0,POINT (-744197.3236671622 1728780.686136521)
07109500,"ARKANSAS RIVER NEAR AVONDALE, CO.",Non-ref,WestMnts,16200.62,11,38.248058,-104.399136,CO,,yes,56.0,46.0,20.0,POINT (-727162.9887640806 1722782.838688171)
07119700,"ARKANSAS RIVER AT CATLIN DAM, NEAR FOWLER, CO.",Non-ref,WestMnts,28168.73,11,38.125839,-103.911901,CO,,,43.0,43.0,18.0,POINT (-686219.8525118355 1705511.095564557)
07124000,"ARKANSAS RIVER AT LAS ANIMAS, CO.",Non-ref,WestPlains,37084.82,11,38.08084,-103.219652,CO,,yes,70.0,60.0,20.0,POINT (-626683.250334717 1695701.518954497)
07124200,"PURGATOIRE RIVER AT MADRID, CO.",Non-ref,WestMnts,1306.913,11,37.129465,-104.639989,CO,,yes,37.0,37.0,20.0,POINT (-759340.3407415807 1599804.647651812)
07126200,"VAN BREMER ARROYO NEAR MODEL, CO.",Non-ref,WestPlains,455.0715,11,37.345573,-103.958019,CO,,yes,43.0,43.0,20.0,POINT (-697524.8526215901 1618702.21939356)
07126300,"PURGATOIRE RIVER NEAR THATCHER, CO.",Non-ref,WestPlains,4989.142,11,37.356406,-103.900238,CO,,yes,43.0,43.0,20.0,POINT (-692371.2775751214 1619489.504767999)
07126325,"TAYLOR ARROYO BL ROCK CROSSING, NR THATCHER, CO.",Non-ref,WestPlains,125.9829,11,37.424183,-103.920238,CO,,yes,15.0,15.0,9.0,POINT (-693487.6956430592 1627204.545426563)
07126390,"LOCKWOOD CANYON CREEK NEAR THATCHER, CO.",Non-ref,WestPlains,127.0305,11,37.492793,-103.828011,CO,,yes,9.0,9.0,3.0,POINT (-684798.1376108965 1634198.397346347)
07126415,"RED ROCK CANYON CREEK AT MOUTH NR THATCHER, CO.",Non-ref,WestPlains,126.1107,11,37.515293,-103.725507,CO,,yes,7.0,7.0,1.0,POINT (-675646.1718540356 1635977.840885621)
07126480,"BENT CANYON CREEK AT MOUTH NEAR TIMPAS, CO",Non-ref,WestPlains,145.5156,11,37.589181,-103.648282,CO,,yes,6.0,6.0,1.0,POINT (-668241.2851125529 1643685.491189277)
07126485,"PURGATOIRE RIVER AT ROCK CROSSING NR TIMPAS, CO.",Non-ref,WestPlains,7177.342,11,37.618347,-103.593557,CO,,yes,21.0,21.0,15.0,POINT (-663209.1898802769 1646560.402138342)
07128500,"PURGATOIRE RIVER NEAR LAS ANIMAS, CO.",Non-ref,WestPlains,8939.203,11,38.033896,-103.200485,CO,,yes,70.0,60.0,20.0,POINT (-625420.9940392071 1690328.757531558)
07130500,"ARKANSAS RIVER BELOW JOHN MARTIN RESERVOIR, CO.",Non-ref,WestPlains,47909.75,11,38.066396,-102.932423,CO,,yes,70.0,60.0,20.0,POINT (-601914.1900751014 1692230.445665342)
07142575,"RATTLESNAKE C NR ZENITH, KS",Non-ref,WestPlains,2685.829,11,38.093625,-98.546189,KS,,yes,36.0,36.0,20.0,POINT (-221163.2675633324 1676281.498461042)
07143672,"L ARKANSAS R AT HWY 50 NR HALSTEAD, KS",Non-ref,WestPlains,2003.394,11,38.028622,-97.540597,KS,,yes,14.0,14.0,14.0,POINT (-133945.2723338097 1667118.523718202)
07144100,"L ARKANSAS R NR SEDGWICK, KS",Non-ref,WestPlains,3200.356,11,37.883067,-97.424486,KS,,yes,16.0,16.0,16.0,POINT (-124095.4622274796 1650648.800357474)
07144780,"NF NINNESCAH R AB CHENEY RE, KS",Ref,WestPlains,2078.906,11,37.862607,-98.013853,KS,yes,yes,44.0,44.0,20.0,POINT (-175480.7838182422 1649284.988745008)
07148350,"Salt Fork Arkansas River nr Winchester, OK",Ref,WestPlains,2141.413,11,36.961696,-98.782312,OK,,,34.0,34.0,4.0,POINT (-245380.7747568182 1550056.552020583)
07150500,"Salt Fork Arkansas River nr Jet, OK",Non-ref,WestPlains,8151.488,11,36.752529,-98.128955,OK,,,56.0,44.0,4.0,POINT (-188295.2548247189 1525138.153670758)
07151000,"Salt Fork Arkansas River at Tonkawa, OK",Non-ref,WestPlains,11558.61,11,36.671979,-97.309489,OK,,yes,74.0,60.0,20.0,POINT (-115947.998034189 1514803.492620142)
07176950,"Hominy Creek near Hominy, OK",Ref,WestPlains,298.7685,11,36.47368,-96.37891,OK,,yes,4.0,4.0,4.0,POINT (-33639.93637539059 1491857.314306822)
07177500,"Bird Creek near Sperry, OK",Non-ref,WestPlains,2348.75,11,36.278425,-95.954162,OK,,yes,71.0,60.0,20.0,POINT (4080.076620673741 1469920.472489806)
07178000,"Bird Creek near Owasso, OK",Non-ref,WestPlains,2629.875,11,36.248705,-95.868602,OK,,yes,25.0,22.0,20.0,POINT (11700.49902088106 1466598.838579057)
07178200,"Bird Ck at State Highway 266 near Catoosa, OK",Non-ref,WestPlains,2909.951,11,36.223151,-95.819432,OK,,yes,21.0,21.0,20.0,POINT (16084.32445947144 1463743.91408938)
07183500,"NEOSHO R NR PARSONS, KS",Non-ref,WestPlains,12544.19,11,37.340059,-95.109969,KS,,yes,88.0,60.0,20.0,POINT (78107.64231148083 1589227.851840717)
07185090,"Tar Creek near Commerce, OK",Non-ref,CntlPlains,89.97778,11,36.94368,-94.85329,OK,,yes,5.0,5.0,5.0,POINT (101168.2944555518 1545056.024331089)
07185095,"Tar Creek at 22nd Street Bridge at Miami, OK",Non-ref,CntlPlains,118.2258,11,36.90007,-94.868288,OK,,yes,14.0,14.0,9.0,POINT (99903.34881754988 1540154.226181142)
07188885,"Indian Creek near Lanagan, MO",Non-ref,EastHghlnds,616.9158,11,36.599278,-94.449639,MO,,yes,9.0,9.0,9.0,POINT (137407.0407007905 1506980.875340117)
071912213,"Spavinaw Creek near Colcord, OK",Non-ref,EastHghlnds,421.0011,11,36.322581,-94.685224,OK,,yes,8.0,8.0,8.0,POINT (116957.6118274941 1475674.260507239)
07191222,"Beaty Creek near Jay, OK",Ref,EastHghlnds,153.8208,11,36.355359,-94.776339,OK,,yes,11.0,11.0,11.0,POINT (108805.5504232091 1479237.132607363)
07198000,"Illinois River near Gore, OK",Non-ref,EastHghlnds,4179.993,11,35.573151,-95.068846,OK,,yes,71.0,60.0,20.0,POINT (83655.59915794023 1391355.494122807)
07227500,"Canadian Rv nr Amarillo, TX",Non-ref,WestPlains,49264.4,11,35.470326,-101.879628,TX,,yes,71.0,60.0,20.0,POINT (-528613.4360782038 1395793.075268017)
07239450,"North Canadian River near Calumet, OK",Non-ref,WestPlains,34279.68,11,35.616993,-98.065332,OK,,yes,21.0,21.0,20.0,POINT (-185432.6998338916 1397868.689514732)
07239500,"North Canadian River near El Reno, OK",Non-ref,WestPlains,34475.45,11,35.563107,-97.95755,OK,,yes,77.0,60.0,20.0,POINT (-175881.2860062612 1391632.751136081)
07239700,"North Canadian River near Yukon, OK",Non-ref,WestPlains,34845.51,11,35.539499,-97.742544,OK,,yes,10.0,10.0,10.0,POINT (-156614.2772139448 1388614.413326327)
07241000,"North Canadian River blw Lk Overholser nr OKC, OK",Non-ref,WestPlains,34927.91,11,35.478669,-97.663375,OK,,yes,54.0,54.0,20.0,POINT (-149618.7693510486 1381678.661248835)
07241520,"North Canadian River at Britton Rd at OKC, OK",Non-ref,WestPlains,35430.48,11,35.565615,-97.367258,OK,,yes,21.0,21.0,20.0,POINT (-122845.3599310189 1390985.740401417)
07241550,"North Canadian River near Harrah, OK",Non-ref,WestPlains,35653.84,11,35.500341,-97.193919,OK,,yes,41.0,41.0,20.0,POINT (-107363.9116890382 1383469.611843046)
07257500,"Illinois Bayou near Scottsville, AR",Non-ref,EastHghlnds,625.6854,11,35.466192,-93.041284,AR,,yes,33.0,31.0,10.0,POINT (266147.3286640271 1383116.08027418)
07277700,"HICKAHALA CREEK NR SENATOBIA, MS",Non-ref,SEPlains,315.3789,08,34.631944,-89.924444,MS,,yes,21.0,21.0,18.0,POINT (552197.9741349918 1303285.78947006)
07283000,"SKUNA RIVER AT BRUCE, MS",Non-ref,SEPlains,668.8198,08,33.973611,-89.347778,MS,,yes,62.0,60.0,20.0,POINT (609676.1674160106 1233374.407097986)
0728875070,"DEER CREEK EAST OF LELAND, MS",Non-ref,SECstPlain,219.9384,08,33.401111,-90.891944,MS,,yes,7.0,7.0,7.0,POINT (471746.2403243762 1160753.478853483)
07288955,"YAZOO RIVER BL STEELE BAYOU NR LONG LAKE, MS",Non-ref,SECstPlain,34855.94,08,32.44417,-90.91417,MS,,yes,12.0,12.0,12.0,POINT (475407.4624964506 1054013.355761437)
07290000,"BIG BLACK RIVER NR BOVINA, MS",Non-ref,SEPlains,7123.855,08,32.347778,-90.696944,MS,,yes,73.0,60.0,20.0,POINT (496291.787327518 1044392.76928802)
07290650,"BAYOU PIERRE NR WILLOWS, MS",Ref,SEPlains,1688.728,08,32.017778,-90.876944,MS,yes,yes,48.0,48.0,20.0,POINT (481444.6747833564 1006742.393152982)
07292500,"HOMOCHITTO RIVER AT ROSETTA, MS",Ref,SEPlains,2073.093,08,31.324722,-91.109444,MS,yes,yes,58.0,58.0,20.0,POINT (463584.6599456014 928520.7073730268)
07299540,"Pr Dog Twn Fk Red Rv nr Childress, TX",Non-ref,WestPlains,18864.19,11,34.569227,-100.194002,TX,,yes,44.0,44.0,20.0,POINT (-381631.864686422 1287036.84882048)
07299890,"Lelia Lk Ck bl Bell Ck nr Hedley, TX",Non-ref,WestPlains,249.2802,11,34.93561,-100.69652,TX,,yes,12.0,12.0,12.0,POINT (-425298.5487633838 1330107.9414177)
07301500,"North Fork Red River near Carter, OK",Ref,WestPlains,6885.075,11,35.168108,-99.507313,OK,yes,yes,63.0,58.0,20.0,POINT (-316705.8951316032 1351456.116685634)
07307800,"Pease Rv nr Childress, TX",Non-ref,WestPlains,7583.054,11,34.227572,-100.073718,TX,,yes,44.0,44.0,20.0,POINT (-372330.4801893631 1248394.542988768)
07308200,"Pease Rv nr Vernon, TX",Non-ref,WestPlains,9139.571,11,34.179252,-99.278137,TX,,yes,39.0,39.0,17.0,POINT (-299834.4267759264 1240183.498545507)
07311700,"N Wichita Rv nr Truscott, TX",Non-ref,WestPlains,2456.588,11,33.820642,-99.786482,TX,,yes,49.0,49.0,20.0,POINT (-347903.6479964457 1201865.891681498)
07311782,"S Wichita Rv at LowFlow Dam Div Pipe nr Guthrie,TX",Non-ref,WestPlains,568.8171,11,33.62203,-100.209,TX,,yes,21.0,21.0,17.0,POINT (-387683.0589957139 1181332.225827351)
07311800,"S Wichita Rv nr Benjamin, TX",Non-ref,WestPlains,1438.061,11,33.644257,-99.800925,TX,,yes,49.0,49.0,20.0,POINT (-350017.8994017029 1182229.02475764)
07311900,"Wichita Rv nr Seymour, TX",Ref,WestPlains,4771.707,11,33.70037,-99.38869,TX,,yes,32.0,32.0,13.0,POINT (-311849.8180058848 1187057.380200472)
07312100,"Wichita Rv nr Mabelle, TX",Non-ref,WestPlains,5275.69,11,33.760093,-99.142849,TX,,yes,50.0,50.0,20.0,POINT (-289013.8433905467 1192948.528850419)
07312200,"Beaver Ck nr Electra, TX",Non-ref,WestPlains,1677.919,11,33.905928,-98.905067,TX,,yes,49.0,49.0,20.0,POINT (-266656.5887998085 1208539.798744321)
07312500,"Wichita Rv at Wichita Falls, TX",Non-ref,WestPlains,8146.337,11,33.909542,-98.533666,TX,,yes,71.0,60.0,20.0,POINT (-232563.5884737748 1207967.967444438)
07312700,"Wichita Rv nr Charlie, TX",Non-ref,WestPlains,8852.896,11,34.05315,-98.296714,TX,,yes,42.0,42.0,20.0,POINT (-210430.5046238689 1223459.583788719)
07331000,"Washita River near Dickson, OK",Non-ref,WestPlains,18573.98,11,34.233427,-96.975845,OK,,yes,81.0,60.0,20.0,POINT (-89209.47866525846 1241525.712905126)
07332390,"Blue River near Connerville, OK",Ref,WestPlains,420.6069,11,34.383426,-96.600558,OK,,yes,9.0,9.0,6.0,POINT (-54796.25462012023 1258010.781062394)
07339000,"Mountain Fork near Eagletown, OK",Non-ref,EastHghlnds,2072.373,11,34.041778,-94.619936,OK,,yes,81.0,60.0,20.0,POINT (126471.1578578171 1220563.896057365)
07342500,"S Sulphur Rv nr Cooper, TX",Non-ref,WestPlains,1356.369,11,33.356499,-95.594956,TX,,yes,67.0,60.0,20.0,POINT (37446.29746827368 1143170.416850783)
07343200,"Sulphur Rv nr Talco, TX",Non-ref,WestPlains,3609.572,11,33.390668,-95.062441,TX,,yes,53.0,53.0,20.0,POINT (86638.56763327408 1147333.440568758)
07343500,"White Oak Ck nr Talco, TX",Non-ref,SEPlains,1393.465,11,33.322336,-95.092718,TX,,yes,59.0,59.0,20.0,POINT (83913.58584189983 1139676.617516715)
07344500,"Big Cypress Ck nr Pittsburg, TX",Non-ref,SEPlains,946.7766,11,33.020958,-94.882155,TX,,,41.0,35.0,0.0,POINT (103783.2629544145 1106243.354996406)
07362693,"Middle Fork Saline River near Owensville, AR",Non-ref,EastHghlnds,240.2685,08,34.63065,-92.82739,AR,,yes,3.0,3.0,3.0,POINT (288501.4141393581 1290299.946384015)
07364133,"BAYOU BARTHOLOMEW AT GARRETT BRIDGE, AR",Non-ref,SECstPlain,1049.648,08,33.866389,-91.656111,AR,,yes,21.0,21.0,19.0,POINT (398851.4751932063 1209162.788916448)
08012150,"Mermentau River At Mermentau, LA",Non-ref,SECstPlain,3576.315,08,30.19,-92.590556,LA,,yes,0.0,0.0,0.0,POINT (327784.703968096 796344.2629808094)
08018500,"Sabine Rv nr Mineola, TX",Non-ref,SEPlains,3538.284,12,32.613747,-95.48579,TX,,yes,62.0,52.0,20.0,POINT (47987.12416905758 1060330.099096796)
08019000,"Lake Fork Ck nr Quitman, TX",Non-ref,SEPlains,1496.832,12,32.763184,-95.463009,TX,,yes,71.0,60.0,20.0,POINT (50018.84926000295 1077010.964149266)
08022040,"Sabine Rv nr Beckville, TX",Non-ref,SEPlains,9301.876,12,32.327379,-94.35353,TX,,yes,71.0,60.0,20.0,POINT (154198.217836879 1029603.757279728)
08030500,"Sabine Rv nr Ruliff, TX",Non-ref,SEPlains,24096.06,12,30.303817,-93.743778,TX,,yes,85.0,60.0,20.0,POINT (216639.8042243493 805672.8888197504)
08048543,"W Fk Trinity Rv at Beach St, Ft Worth, TX",Non-ref,WestPlains,6922.942,12,32.751797,-97.28946,TX,,yes,33.0,33.0,20.0,POINT (-120122.9949797721 1076414.310126679)
08048970,"Village Ck at Everman, TX",Non-ref,WestPlains,233.8857,12,32.603469,-97.265014,TX,,yes,20.0,20.0,20.0,POINT (-118066.0531491206 1059839.78738034)
08049500,"W Fk Trinity Rv at Grand Prairie, TX",Non-ref,WestPlains,7908.254,12,32.798741,-97.02973,TX,,yes,84.0,60.0,20.0,POINT (-95871.52235099876 1081355.91531199)
08053000,"Elm Fk Trinity Rv nr Lewisville, TX",Non-ref,WestPlains,4337.645,12,33.045677,-96.961117,TX,,yes,60.0,60.0,20.0,POINT (-89204.969978129 1108842.9367909)
08062500,"Trinity Rv nr Rosser, TX",Non-ref,WestPlains,21047.79,12,32.42653,-96.463042,TX,,yes,71.0,60.0,20.0,POINT (-43313.75113712767 1039427.902762245)
08062700,"Trinity Rv at Trinidad, TX",Non-ref,WestPlains,22086.05,12,32.134875,-96.105804,TX,,yes,45.0,45.0,20.0,POINT (-9933.340607376125 1006816.45946016)
08063500,"Richland Ck nr Richland, TX",Non-ref,WestPlains,1895.287,12,31.950714,-96.42137,TX,,,49.0,39.0,0.0,POINT (-39650.88658744842 986378.3339219503)
08064100,"Chambers Ck nr Rice, TX",Non-ref,WestPlains,2135.638,12,32.198482,-96.520264,TX,,yes,26.0,26.0,20.0,POINT (-48805.55944738653 1014033.568242218)
08065350,"Trinity Rv nr Crockett, TX",Non-ref,WestPlains,35967.17,12,31.338513,-95.656341,TX,,yes,45.0,45.0,20.0,POINT (32584.85357759807 918183.2634824496)
08066500,"Trinity Rv at Romayor, TX",Non-ref,WestPlains,44412.09,12,30.425207,-94.850762,TX,,yes,85.0,60.0,20.0,POINT (110193.1354130593 817249.0117705408)
08068275,"Spring Ck nr Tomball, TX",Non-ref,SEPlains,483.003,12,30.119939,-95.646056,TX,,yes,10.0,10.0,10.0,POINT (34064.44341132192 782749.7549888585)
08068400,"Panther Br at Gosling Rd, The Woodlands, TX",Non-ref,SEPlains,67.0005,12,30.192159,-95.483829,TX,,yes,11.0,11.0,10.0,POINT (49633.8958043051 790838.255665116)
08068500,"Spring Ck nr Spring, TX",Non-ref,SEPlains,1046.265,12,30.110495,-95.436327,TX,,yes,69.0,59.0,19.0,POINT (54255.26116239597 781798.9577928502)
